{
  "schemaVersion": "1.0",
  "id": "prompt_writer_default",
  "type": "prompt.template",
  "title": "默认写作 Prompt",
  "status": "active",
  "promptRole": "writer",
  "template": "请根据 {{context.goal}} 写作。",
  "variables": [
    {
      "name": "context.goal",
      "required": true,
      "type": "string"
    }
  ],
  "conditionalBlocks": [
    {
      "name": "style_memory",
      "condition": "hasStyleMemory",
      "content": "{{styleMemory}}"
    }
  ],
  "createdAt": "2026-07-03T00:00:00.000Z",
  "updatedAt": "2026-07-03T00:00:00.000Z"
}
